### ISSUE TITLE
ec2 api issue

### ISSUE THREAD

**Issue by haminhcong** [cloudcomputinghust/openstack-manual#5]
i have a problem when running ec2-api client: https://github.com/openstack/ec2-api

when i followed [README](https://github.com/openstack/ec2-api/blob/master/README.rst) guide, i  installed this cilent. 
Next. I installed AWS ec2 client : (pip install awscli). Then i take ec2 credential from openstack command line by : 

``` python
. admin.sh
openstack ec2 credentials create
 openstack ec2 credentials list
```

after that, i have access key and secret key 

```
Type: ec2
{"access":
"50914ae3d875400bab963bbf1f59508d",
"secret":  
"4aca3c76e3ee4e0cab8322ad5c5fbc52",
"trust_id": null}  
```

Next, i started three service 

```
/usr/bin/ec2-api
/usr/bin/ec2-api-metadata
/usr/bin/ec2-api-s3
```

them  i use ec2 api client to make a command :

```
aws --endpoint-url http://(mycontroller ip):8788 ec2 describe-instances
```

but the result is not good:

```
An error occurred (AuthFailure) when calling the DescribeInstances operation: Not Found
```

I have checked http packet go in an go out my controller machine:

```
15:12:57.194433 IP localhost.58267 > localhost.8788: Flags [P.], seq 1:502, ack 1, win 342, options [nop,nop,TS val 21643683 ecr 21643683], length 501
E..)'g@.@..f.........."T.Uf.0......V.......
.JA..JA.POST / HTTP/1.1
Host: bkcloud16:8788
Accept-Encoding: identity
Content-Length: 43
Content-Type: application/x-www-form-urlencoded
X-Amz-Date: 20160809T081257Z
Authorization: AWS4-HMAC-SHA256 Credential=50914ae3d875400b/20160809/ap-southeast-1/ec2/aws4_request, SignedHeaders=host;x-amz-date, Signature=cd280aacaa76dd078ce984203f29e986a2676334acd8d1a9848ab645ec31e448
User-Agent: aws-cli/1.10.53 Python/2.7.6 Linux/3.16.0-76-generic botocore/1.4.43

Action=DescribeInstances&Version=2016-04-01
15:12:57.194454 IP localhost.8788 > localhost.58267: Flags [.], ack 502, win 350, options [nop,nop,TS val 21643683 ecr 21643683], length 0
E..4.|@.@.dE........"T..0....Uh....^.(.....
.JA..JA.
15:12:57.209653 IP localhost.48675 > localhost.35357: Flags [S], seq 1978517759, win 43690, options [mss 65495,sackOK,TS val 21643686 ecr 0,nop,wscale 7], length 0
.JA.........
15:12:57.209685 IP localhost.35357 > localhost.48675: Flags [S.], seq 890260388, ack 1978517760, win 43690, options [mss 65495,sackOK,TS val 21643686 ecr 21643686,nop,wscale 7], length 0
E..<..@.@.<............#5.K.u........0.........
.JA..JA.....
.JA..JA.....
15:12:57.209709 IP localhost.48675 > localhost.35357: Flags [.], ack 1, win 342, options [nop,nop,TS val 21643686 ecr 21643686], length 0
E..4.Z@.@..g.........#..u...5.K....V.(.....
.JA..JA.
15:12:57.209876 IP localhost.48675 > localhost.35357: Flags [P.], seq 1:977, ack 1, win 342, options [nop,nop,TS val 21643686 ecr 21643686], length 976
E....[@.@............#..u...5.K....V.......


.JA..JA.POST /v3/v3/ec2tokens HTTP/1.1
Host: bkcloud16:35357
Connection: keep-alive
Accept-Encoding: gzip, deflate
Accept: */*
User-Agent: python-requests/2.10.0
Content-Type: application/json
Content-Length: 76
{"ec2Credentials": {"access": "50914ae3d875400b", "headers": {"Content-Length": "43", "Accept-Encoding": "identity", "User-Agent": "aws-cli/1.10.53 Python/2.7.6 Linux/3.16.0-76-generic botocore/1.4.43", "Host": "bkcloud16:8788", "X-Amz-Date": "20160809T081257Z", "Content-Type": "application/x-www-form-urlencoded", "Authorization": "AWS4-HMAC-SHA256 Credential=50914ae3d875400b/20160809/ap-southeast-1/ec2/aws4_request, SignedHeaders=host;x-amz-date, Signature=cd280aacaa76dd078ce984203f29e986a2676334acd8d1a9848ab645ec31e448"}, "host": "bkcloud16:8788", "verb": "POST", "params": {}, "signature": "cd280aacaa76dd078ce984203f29e986a2676334acd8d1a9848ab645ec31e448", "path": "/", "body_hash": "768ae9a91b44738b4ba6eef1c07cc9ccd727244145addd8165eefe43f9d49291"}}
15:12:57.209907 IP localhost.35357 > localhost.48675: Flags [.], ack 977, win 357, options [nop,nop,TS val 21643686 ecr 21643686], length 0
E..4
.@.@.2............#5.K.u......e.(.....
.JA..JA.
15:12:57.214124 IP localhost.35357 > localhost.48675: Flags [P.], seq 1:406, ack 977, win 357, options [nop,nop,TS val 21643688 ecr 21643686], length 405
E...
.@.@.1)...........#5.K.u......e.......


.JA..JA.HTTP/1.1 404 Not Found
Date: Tue, 09 Aug 2016 08:12:57 GMT
Server: Apache/2.4.7 (Ubuntu)
Vary: X-Auth-Token
X-Distribution: Ubuntu
x-openstack-request-id: req-f0432603-1441-492a-bae1-7d711b5ad1ab
Content-Length: 93
Keep-Alive: timeout=5, max=100
Connection: Keep-Alive
Content-Type: application/json

{"error": {"message": "The resource could not be found.", "code": 404, "title": "Not Found"}}
```

i think the problem is in ec2-api service:

```
.JA..JA.POST /v3/v3/ec2tokens HTTP/1.1
Host: bkcloud16:35357
```

because the keystone_access.log in controller show:

```
127.0.0.1 - - [09/Aug/2016:15:39:39 +0700] "POST /v3/v3/ec2tokens HTTP/1.1" 404 405 "-" "python-requests/2.10.0"
```

Can anyone tell me what is the problem in here ?
Thank you

**Comment by haminhcong** [comment]
@hieulq ping

**Comment by hieulq** [comment]
@haminhcong instead of capturing packets, can you post the log of all ec2 services here?
Please using some public log paste services such as http://paste.openstack.org/ and paste the links here for avoiding noisy.

**Comment by haminhcong** [comment]
this is the log of ec2-api service 
http://paste.openstack.org/show/555935/

and the log of ec2-api-metadata service
http://paste.openstack.org/show/555941/
and the log of ec2-api-s3 service
http://paste.openstack.org/show/555943/

i ran my test at 3:00 PM ->3.50 PM

**Comment by hieulq** [comment]
@haminhcong can you show the log of keystone (cause I see the error auth fail)?

**Comment by haminhcong** [comment]
this is the log of keystone(/var/log/apache2/keystone_access.log) at the time i ran ec2-api services:
http://paste.openstack.org/show/555958/
